{
  "$schema": "https://json-schema.org/draft/2020-12/schema",
  "$id": "https://opensource.adobe.com/spectrum-design-data/schemas/v0/component-visual.schema.json",
  "title": "Component visual recipe",
  "description": "Layer 1 structural schema for a renderer-neutral component visual recipe (spec/component-visuals.md). Semantic rules (component exists, parts are declared anatomy, relationship selectors resolve) are Layer 2.",
  "type": "object",
  "required": ["component", "root", "parts"],
  "properties": {
    "$schema": {
      "type": "string"
    },
    "$id": {
      "type": "string"
    },
    "specVersion": {
      "type": "string",
      "const": "1.0.0-draft"
    },
    "component": {
      "type": "string",
      "pattern": "^[a-z][a-z0-9-]*$",
      "description": "Name of the component declaration this recipe draws."
    },
    "root": {
      "type": "string",
      "pattern": "^[a-z][a-z0-9-]*$",
      "description": "Key of the root part in `parts`."
    },
    "notVisual": {
      "type": "array",
      "items": { "type": "string", "pattern": "^[a-zA-Z][a-zA-Z0-9-]*$" },
      "uniqueItems": true,
      "description": "Options and states the component declares that deliberately have no visual in this recipe (SPEC-066). Each name MUST be a declared option or state of the component."
    },
    "sizeScale": {
      "type": "object",
      "description": "Maps each size option value to a numeric scale index, substituted for {sizeIndex} in selectors. Selectors may also use {size} and {<option>} for any declared option.",
      "additionalProperties": {
        "type": "integer",
        "minimum": 0
      }
    },
    "parts": {
      "type": "object",
      "minProperties": 1,
      "propertyNames": {
        "pattern": "^[a-z][a-z0-9-]*$"
      },
      "additionalProperties": {
        "$ref": "#/$defs/part"
      }
    }
  },
  "additionalProperties": false,
  "$defs": {
    "part": {
      "type": "object",
      "required": ["kind"],
      "properties": {
        "kind": {
          "enum": ["box", "text", "icon", "ring", "progress"]
        },
        "children": {
          "type": "array",
          "items": {
            "type": "string",
            "pattern": "^[a-z][a-z0-9-]*$"
          },
          "uniqueItems": true
        },
        "visibleWhen": {
          "$ref": "#/$defs/condition"
        },
        "around": {
          "type": "string",
          "pattern": "^[a-z][a-z0-9-]*$",
          "description": "For a ring: the part it outlines. Defaults to the root."
        },
        "glyph": {
          "enum": ["checkmark", "dash"],
          "description": "For an icon nested in a box: the built-in glyph to draw. Unset draws a placeholder."
        },
        "pressTarget": {
          "type": "string",
          "pattern": "^[a-z][a-z0-9-]*$",
          "description": "For the root: the part the press scale applies to, together with the parts nested inside it. Defaults to the whole scene."
        },
        "placement": {
          "type": "object",
          "required": ["anchor"],
          "properties": {
            "anchor": {
              "enum": [
                "top-start",
                "top-end",
                "bottom-start",
                "bottom-end",
                "center"
              ]
            },
            "inset": {
              "$ref": "#/$defs/valueSource"
            }
          },
          "additionalProperties": false
        },
        "props": {
          "type": "object",
          "propertyNames": {
            "enum": [
              "direction",
              "align",
              "justify",
              "gap",
              "paddingInlineStart",
              "paddingInlineEnd",
              "paddingBlockStart",
              "paddingBlockEnd",
              "height",
              "minWidth",
              "width",
              "cornerRadius",
              "cornerRadiusStartStart",
              "cornerRadiusStartEnd",
              "cornerRadiusEndStart",
              "cornerRadiusEndEnd",
              "fill",
              "stroke",
              "strokeWidth",
              "opacity",
              "color",
              "trackColor",
              "fontFamily",
              "fontSize",
              "fontWeight",
              "lineHeight",
              "gapToParent",
              "pressDifference",
              "pressWidthRatio",
              "pressMinPerspective",
              "pressMaxPerspective"
            ]
          },
          "additionalProperties": {
            "oneOf": [
              {
                "$ref": "#/$defs/conditionalValueSource"
              },
              {
                "type": "array",
                "minItems": 1,
                "items": {
                  "$ref": "#/$defs/conditionalValueSource"
                }
              }
            ]
          }
        }
      },
      "additionalProperties": false
    },
    "condition": {
      "type": "object",
      "properties": {
        "options": {
          "type": "object",
          "additionalProperties": {
            "oneOf": [
              {
                "type": ["string", "boolean", "number"]
              },
              {
                "type": "array",
                "minItems": 1,
                "items": {
                  "type": ["string", "boolean", "number"]
                }
              }
            ]
          }
        },
        "states": {
          "type": "array",
          "items": {
            "type": "string",
            "pattern": "^[a-z][a-z0-9-]*$"
          },
          "uniqueItems": true
        },
        "modes": {
          "type": "object",
          "additionalProperties": {
            "type": "string"
          }
        }
      },
      "additionalProperties": false
    },
    "valueSource": {
      "type": "object",
      "oneOf": [
        {
          "required": ["value"],
          "properties": {
            "value": {}
          },
          "additionalProperties": false
        },
        {
          "required": ["token"],
          "properties": {
            "token": {
              "$ref": "#/$defs/tokenSelector"
            }
          },
          "additionalProperties": false
        },
        {
          "required": ["relationship"],
          "properties": {
            "relationship": {
              "$ref": "#/$defs/relationshipSelector"
            }
          },
          "additionalProperties": false
        }
      ]
    },
    "conditionalValueSource": {
      "type": "object",
      "properties": {
        "when": {
          "$ref": "#/$defs/condition"
        },
        "priority": {
          "type": "integer"
        },
        "relativeTo": {
          "enum": ["height"]
        },
        "value": {},
        "token": {
          "$ref": "#/$defs/tokenSelector"
        },
        "relationship": {
          "$ref": "#/$defs/relationshipSelector"
        }
      },
      "additionalProperties": false,
      "oneOf": [
        {
          "required": ["value"]
        },
        {
          "required": ["token"]
        },
        {
          "required": ["relationship"]
        }
      ],
      "description": "A value source with optional `when`, `priority` and `relativeTo`. Used alone or in an ordered list."
    },
    "tokenSelector": {
      "type": "object",
      "minProperties": 1,
      "additionalProperties": {
        "type": ["string", "number", "boolean"]
      }
    },
    "relationshipSelector": {
      "type": "object",
      "required": ["property"],
      "properties": {
        "property": {
          "type": "string",
          "minLength": 1
        },
        "context": {
          "type": "string",
          "minLength": 1
        }
      },
      "additionalProperties": false
    }
  }
}
