{
  "$schema": "https://opensource.adobe.com/spectrum-design-data/schemas/v0/component-visual.schema.json",
  "specVersion": "1.0.0-draft",
  "component": "button",
  "root": "container",
  "sizeScale": {
    "s": 75,
    "m": 100,
    "l": 200,
    "xl": 300
  },
  "parts": {
    "container": {
      "kind": "box",
      "children": ["icon", "progress", "label"],
      "props": {
        "direction": {
          "value": "row"
        },
        "align": {
          "value": "center"
        },
        "justify": {
          "value": "center"
        },
        "height": {
          "relationship": {
            "property": "component-height-{sizeIndex}",
            "context": "Minimum height"
          }
        },
        "paddingInlineStart": [
          {
            "token": {
              "structure": "base",
              "property": "padding-horizontal",
              "size": "{size}"
            }
          },
          {
            "when": {
              "options": {
                "isLabelHidden": true
              }
            },
            "token": {
              "structure": "base",
              "property": "padding-vertical",
              "size": "{size}"
            }
          }
        ],
        "paddingInlineEnd": [
          {
            "token": {
              "structure": "base",
              "property": "padding-horizontal",
              "size": "{size}"
            }
          },
          {
            "when": {
              "options": {
                "isLabelHidden": true
              }
            },
            "token": {
              "structure": "base",
              "property": "padding-vertical",
              "size": "{size}"
            }
          }
        ],
        "gap": {
          "token": {
            "structure": "base",
            "property": "gap",
            "size": "{size}"
          }
        },
        "cornerRadius": {
          "relationship": {
            "property": "corner-radius",
            "context": "Rounding"
          },
          "relativeTo": "height"
        },
        "fill": [
          {
            "when": {
              "options": {
                "variant": "primary",
                "style": "fill"
              }
            },
            "token": {
              "colorFamily": "gray",
              "scaleIndex": 800,
              "property": "color"
            }
          },
          {
            "when": {
              "options": {
                "variant": "primary",
                "style": "fill"
              },
              "states": ["hover"]
            },
            "token": {
              "colorFamily": "gray",
              "scaleIndex": 900,
              "property": "color"
            }
          },
          {
            "when": {
              "options": {
                "variant": "primary",
                "style": "fill"
              },
              "states": ["down"]
            },
            "token": {
              "colorFamily": "gray",
              "scaleIndex": 900,
              "property": "color"
            }
          },
          {
            "when": {
              "options": {
                "variant": "primary",
                "style": "outline"
              }
            },
            "value": "transparent"
          },
          {
            "when": {
              "options": {
                "variant": "primary",
                "style": "outline"
              },
              "states": ["hover"]
            },
            "token": {
              "colorFamily": "gray",
              "scaleIndex": 100,
              "property": "color"
            }
          },
          {
            "when": {
              "options": {
                "variant": "primary",
                "style": "outline"
              },
              "states": ["down"]
            },
            "token": {
              "colorFamily": "gray",
              "scaleIndex": 200,
              "property": "color"
            }
          },
          {
            "when": {
              "options": {
                "variant": "secondary",
                "style": "fill"
              }
            },
            "token": {
              "colorFamily": "gray",
              "scaleIndex": 100,
              "property": "color"
            }
          },
          {
            "when": {
              "options": {
                "variant": "secondary",
                "style": "fill"
              },
              "states": ["hover"]
            },
            "token": {
              "colorFamily": "gray",
              "scaleIndex": 200,
              "property": "color"
            }
          },
          {
            "when": {
              "options": {
                "variant": "secondary",
                "style": "fill"
              },
              "states": ["down"]
            },
            "token": {
              "colorFamily": "gray",
              "scaleIndex": 200,
              "property": "color"
            }
          },
          {
            "when": {
              "options": {
                "variant": "secondary",
                "style": "outline"
              }
            },
            "value": "transparent"
          },
          {
            "when": {
              "options": {
                "variant": "secondary",
                "style": "outline"
              },
              "states": ["hover"]
            },
            "token": {
              "colorFamily": "gray",
              "scaleIndex": 100,
              "property": "color"
            }
          },
          {
            "when": {
              "options": {
                "variant": "secondary",
                "style": "outline"
              },
              "states": ["down"]
            },
            "token": {
              "colorFamily": "gray",
              "scaleIndex": 200,
              "property": "color"
            }
          },
          {
            "when": {
              "options": {
                "variant": "accent",
                "style": "fill"
              }
            },
            "token": {
              "legacyKey": "accent-background-color-default"
            }
          },
          {
            "when": {
              "options": {
                "variant": "accent",
                "style": "fill"
              },
              "states": ["hover"]
            },
            "token": {
              "legacyKey": "accent-background-color-hover"
            }
          },
          {
            "when": {
              "options": {
                "variant": "accent",
                "style": "fill"
              },
              "states": ["down"]
            },
            "token": {
              "legacyKey": "accent-background-color-down"
            }
          },
          {
            "when": {
              "options": {
                "variant": "negative",
                "style": "fill"
              }
            },
            "token": {
              "legacyKey": "negative-background-color-default"
            }
          },
          {
            "when": {
              "options": {
                "variant": "negative",
                "style": "fill"
              },
              "states": ["hover"]
            },
            "token": {
              "legacyKey": "negative-background-color-hover"
            }
          },
          {
            "when": {
              "options": {
                "variant": "negative",
                "style": "fill"
              },
              "states": ["down"]
            },
            "token": {
              "legacyKey": "negative-background-color-down"
            }
          },
          {
            "when": {
              "options": {
                "staticColor": "white",
                "variant": "primary",
                "style": "fill"
              }
            },
            "token": {
              "colorFamily": "transparent-white",
              "scaleIndex": 800,
              "property": "color"
            }
          },
          {
            "when": {
              "options": {
                "staticColor": "white",
                "variant": "secondary",
                "style": "fill"
              }
            },
            "token": {
              "colorFamily": "transparent-white",
              "scaleIndex": 100,
              "property": "color"
            }
          },
          {
            "when": {
              "options": {
                "staticColor": "black",
                "variant": "primary",
                "style": "fill"
              }
            },
            "token": {
              "colorFamily": "transparent-black",
              "scaleIndex": 800,
              "property": "color"
            }
          },
          {
            "when": {
              "options": {
                "staticColor": "black",
                "variant": "secondary",
                "style": "fill"
              }
            },
            "token": {
              "colorFamily": "transparent-black",
              "scaleIndex": 100,
              "property": "color"
            }
          },
          {
            "when": {
              "options": {
                "staticColor": "white",
                "variant": "primary",
                "style": "outline"
              },
              "states": ["hover"]
            },
            "token": {
              "colorFamily": "transparent-white",
              "scaleIndex": 100,
              "property": "color"
            }
          },
          {
            "when": {
              "options": {
                "staticColor": "white",
                "variant": "primary",
                "style": "outline"
              },
              "states": ["down"]
            },
            "token": {
              "colorFamily": "transparent-white",
              "scaleIndex": 100,